russiarunning_Костюмированный пробег Дедов Морозов_2026-01-01	https://russiarunning.com/event/74747/
russiarunning_ЗАБЕГ ЖЕЛАНИЙ 2026_ГОРСОВЕТ_2026-01-01	https://russiarunning.com/event/ZABEGZhELANIY2026GORSOVET/
russiarunning_O-TRAIL Бегу и обещаю 2026_2026-01-01	https://russiarunning.com/event/OTRAILBeguiobeshchayu2026/
russiarunning_Кинопросмотр с BATYR в Monkey Grinder_2026-01-01	https://russiarunning.com/event/cinema2026/
russiarunning_Забег обещаний Тула 2026_2026-01-01	https://russiarunning.com/event/ZabegobeshchaniyTula2026/
russiarunning_Новогодний забег_2026-01-01	https://russiarunning.com/event/newyear26/
russiarunning_НОВОГОДНИЙ ЗАБЕГ_2026-01-03	https://russiarunning.com/event/NOVOGODNIYZABEG2026/
russiarunning_Онлайн Новогодний забег по всей России в помощь животным Run With Love 03.01_2026-01-03	https://russiarunning.com/event/Novorossiysk0301/
russiarunning_Новогодний многодневный забег «Пельменный Кубок» - 1 этап город Сарапул_2026-01-04	https://russiarunning.com/event/NovogodniymnogodnevnyyzabegPelmennyyKubok1etapgorodSarapul/
russiarunning_69 Пробег-Марафон "Покровские Пруды - Здравствуй Новый Год 2026" 04.01.2026_2026-01-04	https://russiarunning.com/event/69ProbegMarafonPokrovskiePrudyZdravstvuyNovyyGod202604012026/
russiarunning_Тренировочный тур в новогодние праздники в ОАЭ_2026-01-04	https://russiarunning.com/event/oae01/
russiarunning_Trikotlet Indoor, 2 этап_2026-01-04	https://russiarunning.com/event/TRIKOTLETINDOOR2etap04012026/
russiarunning_Новогодний многодневный забег "Пельменный Кубок" - 2 этап город Воткинск_2026-01-05	https://russiarunning.com/event/NovogodniymnogodnevnyyzabegPelmennyyKubok2etapgorodVotkinsk/
russiarunning_III Тульский Зимний Трейл _2026-01-05	https://russiarunning.com/event/IIITulskiyZimniyTreyl/
russiarunning_2 ЭТАП "УФА_ЛЫЖНАЯ СРЕДА"_2026-01-05	https://russiarunning.com/event/2ETAPUFALYZhNAYaSREDA/
russiarunning_Лыжный кэмп в Рамзау_2026-01-06	https://russiarunning.com/event/ramsau-ski/
russiarunning_"Рождественская гонка" (Демино)_2026-01-06	https://russiarunning.com/event/RozhdestvenskayagonkaDemino/
russiarunning_Семейный новогодний тур в ОАЭ_2026-01-06	https://russiarunning.com/event/oae2026/
russiarunning_54 Пробег-Марафон "BITSA RUN - Рождество 2026" 07.01.2026_2026-01-07	https://russiarunning.com/event/54ProbegMarafonBITSARUNRozhdestvo202607012026/
russiarunning_Приключение на Кавказских Минеральных Водах_2026-01-07	https://russiarunning.com/event/kavkaz/
russiarunning_РОЖДЕСТВЕНСКИЙ ЗАБЕГ_2026-01-07	https://russiarunning.com/event/ROZhDESTVENSKIYZABEG2026/
russiarunning_Рождественский полумарафон_2026-01-07	https://russiarunning.com/event/IceHalfMarathon/
russiarunning_XXII лыжная гонка на призы Заслуженного тренера России Валерия Анатольевича Мелентьева_2026-01-07	https://russiarunning.com/event/lsmk2026/
russiarunning_Рождественский забег 2026_2026-01-07	https://russiarunning.com/event/2026ChristmasRun/
russiarunning_Бегущий экскурсовод: Беговая экскурсия по центру Петербурга 08 января_2026-01-08	https://russiarunning.com/event/BegushchiyekskursovodBegovayaekskursiyapotsentruPeterburga08yanvarya/
russiarunning_Карелия. Лыжный кэмп_2026-01-08	https://russiarunning.com/event/karelia01/
russiarunning_Тюменский вираж_2026-01-09	https://russiarunning.com/event/Tyumenskiyvirazh/
russiarunning_Новогодний многодневный забег "Пельменный Кубок" - 3 этап город Ижевск_2026-01-09	https://russiarunning.com/event/NovogodniymnogodnevnyyzabegPelmennyyKubok3etapgorodIzhevsk/
russiarunning_КОНТРОЛЬНЫЙ БЕГ 10.01.2026_2026-01-10	https://russiarunning.com/event/KONTROLNYYBEG10012026/
russiarunning_70 Пробег-Марафон "Покровские Пруды - Рождество 2026" 11.01.2026_2026-01-11	https://russiarunning.com/event/70ProbegMarafonPokrovskiePrudyRozhdestvo202611012026/
russiarunning_Забег-полумарафон "ONLINE RACE"_2026-01-12	https://russiarunning.com/event/ZabegpolumarafonONLINERACE4/
russiarunning_ДЕТСКАЯ и ЮНИОРСКАЯ ЛИГИ. ЯНВАРЬ -2026_2026-01-11	https://russiarunning.com/event/DETSKAYaiYuNIORSKAYaLIGIYaNVAR2026/
russiarunning_"Россия бежит!" (онлайн забег)_2026-01-12	https://russiarunning.com/event/Rossiyabezhitonlaynzabeg2026/
russiarunning_Зимний забег DAGRUN 2026_2026-01-11	https://russiarunning.com/event/ZimniyzabegDAGRUN2026/
russiarunning_Рождественский пробег деда мороза_2026-01-11	https://russiarunning.com/event/369/
russiarunning_Онлайн-марафон "ЗОЛОТОЕ КОЛЬЦО" _2026-01-12	https://russiarunning.com/event/OnlaynmarafonZOLOTOEKOLTsO2026/
russiarunning_Онлайн-полумарафон "ВОЛГА-ВОЛГА" _2026-01-12	https://russiarunning.com/event/OnlaynpolumarafonVOLGAVOLGA20026/
russiarunning_Онлайн Новогодний забег по всей России в помощь животным Run With Love 13.01_2026-01-13	https://russiarunning.com/event/Novorossiysk1301/
russiarunning_Лыжный кемп в Альпах_2026-01-13	https://russiarunning.com/event/toblach-ski/
russiarunning_TOPSKI Online 2025-2026_2026-01-15	https://russiarunning.com/event/TOPSKIOnline20252026/
russiarunning_Онлайн-забег "Забег вдохновения"_2026-01-15	https://russiarunning.com/event/Vdohnovenie/
russiarunning_Регистрация болельщиков на Альфа-Банк Кубок России по биатлону – 3 этап (16-18 января 2026)_2026-01-16	https://russiarunning.com/event/DeminoFan26/
russiarunning_Серия MallRun. Новый год в Планете. _2026-01-16	https://russiarunning.com/event/SeriyaMallRunNovyygodvPlanete16012026/
russiarunning_Марафон Toblach-Cortina_2026-01-16	https://russiarunning.com/event/MarafonToblachCortina/
russiarunning_PIONER CUP 2 этап Масс-старт'26_2026-01-17	https://russiarunning.com/event/PionerCupMASS-START26/
russiarunning_Пробег Деда мороза Старыйновый год_2026-01-17	https://russiarunning.com/event/ProbegDedamorozaStaryynovyygod/
russiarunning_54 Пробег-Марафон "BITSA RUN" 17.01.2026_2026-01-17	https://russiarunning.com/event/54ProbegMarafonBITSARUN17012026/
russiarunning_Зимний любительский заплыв на сапбордах Зы-зы-зы 2026_2026-01-17	https://russiarunning.com/event/zyzyzy2026/
russiarunning_Открытые областные соревнования по лыжным гонкам на территории Балахнинского муниципального округа «Балахнинская лыжня» 2026 год (Классический ход)_2026-01-17	https://russiarunning.com/event/OtkrytyeoblastnyesorevnovaniyapolyzhnymgonkamnaterritoriiBalakhninskogomunitsipalnogookrugaBalakhninskayalyzhnya2026godKlassicheskiykhod/
russiarunning_120 Некрасовский марафон_2026-01-17	https://russiarunning.com/event/CXXNekrasovskiimarathon/
russiarunning_Бегущий экскурсовод: беговая экскурсия по центру Петербурга 17 января_2026-01-17	https://russiarunning.com/event/BegushchiyekskursovodbegovayaekskursiyapotsentruPeterburga17yanvarya/
russiarunning_онлайн и офлайн Любительский забег в помощь животным на Воробьевых горах Run With Love 18.01_2026-01-18	https://russiarunning.com/event/Vorobevy1801/
russiarunning_3 этап_Уфа-лыжная среда_5км классика_2026-01-21	https://russiarunning.com/event/3etapUfalyzhnayasreda5kmklassika/
russiarunning_121 Некрасовский марафон_2026-01-24	https://russiarunning.com/event/CXXINekrasovskiimarathon/
russiarunning_Королева Спорта_2026-01-24	https://russiarunning.com/event/QueenofSports/
russiarunning_Лыжные гонки на Кубок Губернатора Санкт-Петербурга, 1 этап_2026-01-24	https://russiarunning.com/event/skisprint1_2026/
russiarunning_Твой лыжный отпуск в Альпах_2026-01-24	https://russiarunning.com/event/Your_Ski_Vacation_in_the_Alps/
russiarunning_Первая дорожка 2026_2026-01-24	https://russiarunning.com/event/ftw2026/
russiarunning_Мультиспортивная детская лига Липецкой области 3.0. 4 этап. Плавание. 24.01.2026_2026-01-24	https://russiarunning.com/event/MultisportivnayadetskayaligaLipetskoyoblasti304etapPlavanie24012026/
russiarunning_WBU Шри-Ланка_2026-01-24	https://russiarunning.com/event/wbu2026/
russiarunning_Благотворительный лыжный забег "Зов рождения" _2026-01-25	https://russiarunning.com/event/zovrozhdeniya_2026/
russiarunning_TOPSKI FAMILY 2 этап_2026-01-25	https://russiarunning.com/event/TOPSKIFAMILY2etap/
russiarunning_71 Пробег-Марафон "Покровские Пруды" 25.01.2026_2026-01-25	https://russiarunning.com/event/ProbegMarafonPokrovskiePrudy25012026/
russiarunning_Твой лыжный отпуск в Альпах _2026-01-28	https://russiarunning.com/event/TvoylyzhnyyotpuskvAlpakh/
russiarunning_XII Самарский лыжный фестиваль «Сокольи Горы»_2026-01-29	https://russiarunning.com/event/XIISamarskiylyzhnyyfestivalSokoliGory/
russiarunning_Беги за удачей - Февраль_2026-01-30	https://russiarunning.com/event/Begizaudachey1/
russiarunning_IRONLADY, STARKIDS EGYPT 2026_2026-01-30	https://russiarunning.com/event/RUNNINGEGYPT2026/
russiarunning_IRONSTAR 113 & OLYMPIC EGYPT 2026_2026-01-30	https://russiarunning.com/event/IronStarEgypt2026/
russiarunning_72 Пробег-Марафон "Покровские Пруды" 31.01.2026_2026-01-31	https://russiarunning.com/event/55ProbegMarafonBITSARUN31012026/
russiarunning_Международный лыжный марафон PLANICA SKI MARATHON_2026-01-31	https://russiarunning.com/event/planicaski2026/
russiarunning_IRONSTAR EGYPT 2026_2026-01-31	https://russiarunning.com/event/IRONSTAR113EGYPT2026/
russiarunning_Фитнес-гонка Crace 31_01_2026-01-31	https://russiarunning.com/event/FitnessraceCrace3101/
russiarunning_Открытые соревнования по лыжным гонкам "Шибаловская лыжня 2026"_2026-01-31	https://russiarunning.com/event/Shibalovskayalyzhnya2026/
russiarunning_PIONER CUP 3 этап Индивидуальная Гонка+Эстафета'26_2026-01-31	https://russiarunning.com/event/PionerCupIndRace26/
russiarunning_I Открытый лыжный марафон «Настоящий мужик. Классик.»_2026-01-31	https://russiarunning.com/event/IOtkrytyylyzhnyymarafonNastoyashchiymuzhikKlassik/
russiarunning_Trikotlet Indoor, 3 этап_2026-02-01	https://russiarunning.com/event/TrikotletIndoor3etap/
russiarunning_Пробежка: Прощай, Оливье!_2026-02-01	https://russiarunning.com/event/ProschayOlivie/
russiarunning_55-й легкоатлетический пробег «Пулково — Пушкин»_2026-02-01	https://russiarunning.com/event/55ylegkoatleticheskiyprobegPulkovoPushkin/
russiarunning_Детский зимний дуатлон "Шестигранник"_2026-02-01	https://russiarunning.com/event/Zimniitriathlon/
russiarunning_Твой лыжный отпуск в Альпах, Тоблах_2026-02-02	https://russiarunning.com/event/TvoylyzhnyyotpuskvAlpakhToblakh/
russiarunning_4 ЭТАП_УФА-ЛЫЖНАЯ СРЕДА_ГОРА_1КМ_2026-02-04	https://russiarunning.com/event/4ETAPUFALYZhNAYaSREDAGORA1KM/
russiarunning_3й УФИМСКИЙ ЛЫЖНЫЙ КЛАССИЧЕСКИЙ МАРАФОН_2026-02-07	https://russiarunning.com/event/3yUFIMSKIYLYZhNYYKLASSIChESKIYMARAFON/
russiarunning_Детская лига триатлона Сибири (акватлон) 2026_2026-02-07	https://russiarunning.com/event/DetskayaligatriatlonaSibiriakvatlon2026/
russiarunning_Зимний триатлон на Кубок Губернатора Санкт-Петербурга 2026_2026-02-07	https://russiarunning.com/event/wintertri2026/
russiarunning_онлайн и офлайн Любительский забег в помощь животным на Воробьевых горах Run With Love 07.02_2026-02-07	https://russiarunning.com/event/VorobevyGory0702/
russiarunning_Лыжный кемп в Италии: Олимпийские игры 2026. Заезд 1_2026-02-07	https://russiarunning.com/event/olympic-games-1race/
russiarunning_Деминская ночная гонка_2026-02-07	https://russiarunning.com/event/Nochnaya_Demino/
russiarunning_ГОЛОС ЗИМЫ - семейный праздник любителей лыжного спорта_2026-02-07	https://russiarunning.com/event/goloszima2026/
russiarunning_Indoor Triathlon Perm cup 2025-26 2 этап_2026-02-07	https://russiarunning.com/event/IndoorTriathlonPermcup2025262etap/
russiarunning_Ночная лыжная гонка – 2026_2026-02-07	https://russiarunning.com/event/bogatysaby2026/
russiarunning_Крутые пингвины_2026-02-08	https://russiarunning.com/event/08022026/
russiarunning_Бештаугорский Крест Зимний 2026_2026-02-08	https://russiarunning.com/event/BeshtaugorskiyKrestZimniy2026/
russiarunning_Пробег по Лужнецкой набережной за медаль_2026-02-08	https://russiarunning.com/event/ProbegpoLuzhnetskoynaberezhnoyzamedal/
russiarunning_Тур-перезагрузка на Байкал_2026-02-10	https://russiarunning.com/event/baikal2026/
russiarunning_Чемпионат и Первенство Санкт-Петербурга по триатлону (дисциплина акватлон) 2026_2026-02-12	https://russiarunning.com/event/aquathlonspb2026/
russiarunning_HONOR Vladivostok Ice Run 2026_2026-02-14	https://russiarunning.com/event/ICERUN26/
russiarunning_Регистрация болельщиков на международные соревнования по фристайлу «Кубок чемпионов» — 2026_2026-02-13	https://russiarunning.com/event/Fan_Podolino_26/
russiarunning_PIONER CUP 4 этап Спринт+Эстафета'26_2026-02-14	https://russiarunning.com/event/PionerCupSprint26/
russiarunning_Триатлон на Кубок Губернатора Санкт-Петербурга на дистанцию "суперспринт", 1 этап_2026-02-14	https://russiarunning.com/event/st_petersburg_indoor26_stage1/
russiarunning_Благотворительная лыжня «Самое время жить» 2026_2026-02-14	https://russiarunning.com/event/timetoski2026/
russiarunning_ДЕНЬ СВЯТОГО ВАЛЕНТИНА_2026-02-14	https://russiarunning.com/event/DENSVYaTOGOVALENTINA2026/
russiarunning_Яратам Run (Любовь на бегу)_2026-02-14	https://russiarunning.com/event/loverun2026/
russiarunning_Мультиспортивная детская лига Липецкой области 3.0. 5 этап. Лыжные гонки. 14.02.2026_2026-02-14	https://russiarunning.com/event/MultisportivnayadetskayaligaLipetskoyoblasti305etapLyzhnyegonki14022026/
russiarunning_ТРЕЙЛ ЗИМНИЕ КЛЮЧИ_2026-02-14	https://russiarunning.com/event/TreylZimnieklyuchi2026/
russiarunning_NOVGOROD ICE 2026_2026-02-14	https://russiarunning.com/event/NOVGORODICE2026/
russiarunning_ Пробег_2026-02-15	https://russiarunning.com/event/170ProbegMarafonBittsevskayaPryamaya15122026/
russiarunning_Зимний Павловский забег 2026_2026-02-15	https://russiarunning.com/event/ZimniyPavlovskiyzabeg2026/
russiarunning_Спортивная Россия_2026-02-16	https://russiarunning.com/event/SportivnayaRossiya/
russiarunning_Областные соревнования по лыжным гонкам Балахнинского муниципального округа, посвящённых памяти тренера А. П. Абрамычева (Коньковый ход) 2026_2026-02-15	https://russiarunning.com/event/OblastnyesorevnovaniyapolyzhnymgonkamBalakhninskogomunitsipalnogookrugaposvyashchyonnykhpamyatitreneraAPAbramychevaKonkovyykhod2026/
russiarunning_Пробег : люблю  бег!_2026-02-15	https://russiarunning.com/event/Probeglyublyubeg/
russiarunning_Лыжный кэмп в Италии: Олимпийские игры 2026. Заезд 2_2026-02-16	https://russiarunning.com/event/olympic-games-2race/
russiarunning_5 ЭТАП_УФА-ЛЫЖНАЯ СРЕДА_5км_2026-02-18	https://russiarunning.com/event/5ETAPUFALYZhNAYaSREDA5km/
russiarunning_Семейная Спортивная Лига: Весенний этап 1_2026-02-21	https://russiarunning.com/event/Semeinayasportivnayaliga-1/
russiarunning_O-TRAIL Эстафета поколений 2026_2026-02-21	https://russiarunning.com/event/OTRAILEstafetapokoleniy2026/
russiarunning_122 Некрасовский марафон_2026-02-21	https://russiarunning.com/event/CXXIINekrasovskiimarathon/
russiarunning_Спортивная азбука. Конькобежный спорт_2026-02-21	https://russiarunning.com/event/sportazbukaKS/
russiarunning_Лыжные гонки на Кубок Губернатора Санкт-Петербурга, 2 этап_2026-02-21	https://russiarunning.com/event/skisprint2_2026/
russiarunning_PIONER CUP 5 этап Индивидуальная Гонка+Эстафета'26_2026-02-21	https://russiarunning.com/event/PionerCupIndivRace26/
russiarunning_ГОД ЛОШАДИ_2026-02-21	https://russiarunning.com/event/GODLOShADI/
russiarunning_КОНТРОЛЬНЫЙ БЕГ 21.02.2026_2026-02-21	https://russiarunning.com/event/KONTROLNYYBEG21022026/
russiarunning_Пробег-Марафон "Покровские Пруды - День Защитника Отечества 2026" 22.02.2026_2026-02-22	https://russiarunning.com/event/ProbegMarafonPokrovskiePrudy22022026/
russiarunning_АЛЬФА-БАНК HARD RUN_2026-02-22	https://russiarunning.com/event/HARDRUN2026/
russiarunning_Зимний забег "Полуниха трейл" _2026-02-22	https://russiarunning.com/event/ZimniyzabegPolunikhatreyl/
russiarunning_TOPSKI FAMILY 3 этап _2026-02-22	https://russiarunning.com/event/TOPSKIFAMILY3etap2026/
russiarunning_Эчки-Даг Трейл_2026-02-22	https://russiarunning.com/event/echkidag/
russiarunning_Девятый Кубок бегового клуба "ChelRunners"_2026-02-22	https://russiarunning.com/event/DevyatyyKubokbegovogoklubaChelRunners/
russiarunning_Зимний Егорьевский марафон BELLA RUN 2026 _2026-02-22	https://russiarunning.com/event/ZimniyEgorevskiymarafonBELLARUN2026/
russiarunning_Индор: Чемпионат Самарской области по акватлону "Акваспринт" 2026_2026-02-22	https://russiarunning.com/event/IndorChempionatSamarskoyoblastipoakvatlonu/
russiarunning_Марчалонга по-башкирСки 2026_2026-02-22	https://russiarunning.com/event/IIMarchalongapoBashkirSki75km2025/
russiarunning_Контрольная тренировка "Обгоняя ветер. Зима 2026"_2026-02-22	https://russiarunning.com/event/KontrolnayatrenirovkaObgonyayaveterZima2026/
russiarunning_«Рыцарский рейд: Тропа отваги»_2026-02-23	https://russiarunning.com/event/RytsarskiyreydTropaotvagi/
russiarunning_Лыжный фестиваль "Февральская метель"_2026-02-23	https://russiarunning.com/event/snowstorm2026/
russiarunning_Трейл «Я - Патриот» 2026_2026-02-23	https://russiarunning.com/event/patriot-2026/
russiarunning_Патриотический забег «СВОи»_2026-02-23	https://russiarunning.com/event/PatrioticheskiyzabegSVOi/
russiarunning_Восхождение на Килиманджаро. Маршрут Лемошо_2026-02-23	https://russiarunning.com/event/kililemosho/
russiarunning_Дёмская Тридцатка 2026_2026-02-23	https://russiarunning.com/event/dema2026/
russiarunning_Карелия. Лыжный кемп_2026-02-27	https://russiarunning.com/event/karelia26/
russiarunning_Регистрация болельщиков на 19 традиционный Ростех Деминский лыжный марафон_2026-02-27	https://russiarunning.com/event/DeminoFanMarathon/
russiarunning_123 Некрасовский марафон_2026-02-28	https://russiarunning.com/event/CXXIIINekrasovskiimarathon/
russiarunning_Турция. Походы по Ликийской тропе_2026-02-28	https://russiarunning.com/event/turkey26/
russiarunning_Ледовый полумарафон "Winter Ice Halfmarathon"_2026-02-28	https://russiarunning.com/event/LedovyypolumarafonWinterIceHalfmarathon/
russiarunning_III Арктический Забег_2026-02-28	https://russiarunning.com/event/arcticzabeg2026/
russiarunning_Трейл Снега Кириллова_2026-02-28	https://russiarunning.com/event/TrailSnowKirillov/
russiarunning_онлайн и офлайн Любительский забег в помощь животным на Воробьевых горах Run With Love 28.02_2026-02-28	https://russiarunning.com/event/VorobevyGory2802/
russiarunning_ТРЕЙЛ МЕЛОДИЯ ВЬЮГИ_2026-02-28	https://russiarunning.com/event/TreylMelodiyavyugi2026/
russiarunning_Забег БЕЛЫХ ПОМПОНОВ_2026-03-01	https://russiarunning.com/event/ZabegBELYEPOMPONY/
russiarunning_Легкоатлетический пробег на Кубок Губернатора Санкт-Петербурга, 1 этап_2026-03-01	https://russiarunning.com/event/spbrun12026/
russiarunning_ЛУКА УЛЬТРА ТРЕЙЛ Зима 2026 Самара LUKA ULTRA_2026-03-01	https://russiarunning.com/event/LUKAULTRASNOWTRAIL2026/
russiarunning_Снежный забег 2026_2026-03-01	https://russiarunning.com/event/snow_run_2026/
russiarunning_Trikotlet Indoor, 4 этап_2026-03-01	https://russiarunning.com/event/TrikotketIndoor4etap/
russiarunning_Лыжный марафон #СалопТурSki 40км_2026-03-01	https://russiarunning.com/event/LyzhnyymarafonSalopTurSki410rv/
russiarunning_II благотворительная Добрая лыжня Совкомбанк '26_2026-03-01	https://russiarunning.com/event/BlagotvoritelnayaDobrayalyzhnya26/
russiarunning_ДИНАМОВСКАЯ ТРИДЦАТКА 2026_2026-03-01	https://russiarunning.com/event/DINAMOVSKAYaTRIDTsATKA2026/
russiarunning_Семья на спорте_2026-03-01	https://russiarunning.com/event/Semyanasporte/
russiarunning_Лыжный кемп Энгадин, Швейцария_2026-03-03	https://russiarunning.com/event/engadin-ski/
russiarunning_Праздничный тур в душевную Армению_2026-03-06	https://russiarunning.com/event/armenia26/
russiarunning_ДЕТСКАЯ и ЮНИОРСКАЯ ЛИГИ. МАРТ -2026_2026-03-07	https://russiarunning.com/event/DETSKAYaiYuNIORSKAYaLIGIMART2026/
russiarunning_Праздничный Культурный Марафон _2026-03-07	https://russiarunning.com/event/PrazdnichnyyKulturnyyMarafon/
russiarunning_Забег "8 МАРТА"_2026-03-08	https://russiarunning.com/event/Zabeg8MARTA/
russiarunning_На Вираже_2026-03-08	https://russiarunning.com/event/NaVirazhe2026/
russiarunning_VIII Весенний 💐марафон 8 марта ♥ (Орден Св.Татьяны)_2026-03-08	https://russiarunning.com/event/8marta2026/
russiarunning_Пробег-Марафон "Покровские Пруды - Международный Женский День 2026" 08.03.2026_2026-03-08	https://russiarunning.com/event/ProbegMarafonPokrovskiePrudyMezhdunarodnyyZhenskiyDen202608032026/
russiarunning_ДЕВОЧКИ БЕГУТ_2026-03-08	https://russiarunning.com/event/DEVOChKIBEGUT2026/
russiarunning_УФИМСКИЙ ЛЫЖНЫЙ МАРАФОН 2026_2026-03-08	https://russiarunning.com/event/ulm2026/
russiarunning_АЛЬФА-БАНК Beauty Run_2026-03-08	https://russiarunning.com/event/BeautyRun2026/
russiarunning_Полумарафон EDP Lisbon Half Marathon_2026-03-08	https://russiarunning.com/event/LisbonHalfMarathon/
russiarunning_МУЛЬТИ СЕРИЯ _ ДИСНЕЙ _  ИСТОРИЯ ИГРУШЕК 🐇🐅🦜_2026-03-09	https://russiarunning.com/event/MULTISERIYaDISNEYISTORIYaIGRUShEK/
russiarunning_Плавательный кемп Геленджик_2026-03-09	https://russiarunning.com/event/SwimcampsGeledzhik/
russiarunning_ДЕВОЧКИ СНОВА БЕГУТ_2026-03-09	https://russiarunning.com/event/DEVOChKISNOVABEGUT/
russiarunning_Башкирский лыжный сверхмарафон 100км 2026_2026-03-14	https://russiarunning.com/event/BashkirSki_100km/
russiarunning_Стальной характер Тюмень Холод 2026 _2026-03-14	https://russiarunning.com/event/StalnoykharakterTyumenKholod2026/
russiarunning_Марафон по ходьбе и бегу город Хадыженск_2026-03-14	https://russiarunning.com/event/travalev2026/
russiarunning_Триатлон на Кубок Губернатора Санкт-Петербурга на дистанцию "суперспринт", 2 этап_2026-03-14	https://russiarunning.com/event/st_petersburg_indoor26_stage2/
russiarunning_Открытые Республиканские соревнования по плаванию среди любителей «Калашников Спорт»_2026-03-14	https://russiarunning.com/event/plavaniekalashnikovsport/
russiarunning_PIONER CUP 6 этап Сингл-Микст'26_2026-03-14	https://russiarunning.com/event/PionerCupSingleMixed26/
russiarunning_Открытый турнир "Царь зимы" по бегу в гору_2026-03-14	https://russiarunning.com/event/OtkrytyyturnirTsarzimypobeguvgoru/
russiarunning_Пробежка за медаль по Лужекцкой набережной_2026-03-15	https://russiarunning.com/event/ProbezhkazamedalpoLuzhektskoynaberezhnoy/
russiarunning_Верхнекамский зимний фестиваль спорта_2026-03-15	https://russiarunning.com/event/Verkhnekamskiyzimniyfestivalsporta/
russiarunning_IV Лыжный марафон "Березниковские Полсотни"_2026-03-15	https://russiarunning.com/event/IVLYZhNYYMARAFONBEREZNIZNIKOVSKIEPOLSOTNI/
russiarunning_Indoor-triathlon Tula_2026-03-15	https://russiarunning.com/event/Indoortriatlon/
russiarunning_ЭКОЛОГО- ПРОСВЕТИТЕЛЬСКОЕ МЕРОПРИЯТИЕ «МАРАФОН «КАРАДАГ» 2026_2026-03-15	https://russiarunning.com/event/EKOLOGOPROSVETITELSKOEMEROPRIYaTIEMARAFONKARADAG2026/
russiarunning_ХВОСТАТЫЙ ЗАБЕГ ПО САДОВОМУ КОЛЬЦУ 2026_2026-03-15	https://russiarunning.com/event/KhVOSTATYYZABEGPOSADOVOMUKOLTsU2026/
russiarunning_Кубок СИЯНИЯ_2026-03-17	https://russiarunning.com/event/Siyanie/
russiarunning_«TRIATHLON KARELIA» 2026_2026-03-20	https://russiarunning.com/event/WINTRIATHLONKARELIA2026/
russiarunning_Симферопольский полумарафон _2026-03-22	https://russiarunning.com/event/Simferopolskiypolumarafon/
russiarunning_Стальной Характер Холод Пермь 2026_2026-03-21	https://russiarunning.com/event/StalnoyKharakterKholodKholodPerm2026/
russiarunning_СОРЕВНОВАНИЕ ПО ТРЕЙЛУ «УБИНСКИЙ УЛЬТРАМАРАФОН «ВИКИНГИ» _2026-03-21	https://russiarunning.com/event/SOREVNOVANIEPOTREYLUUBINSKIYULTRAMARAFONVIKINGI/
russiarunning_XII Лыжный марафон ЗЮРАТКУЛЬ" 2026_2026-03-21	https://russiarunning.com/event/ZYuRATKUL2026/
russiarunning_Indoor Triathlon Perm cup 2025-2026 финал_2026-03-21	https://russiarunning.com/event/IndoorTriathlonPermcup20252026final/
russiarunning_O-TRAIL FerrumFest 2026_2026-03-21	https://russiarunning.com/event/OTRAILFerrumFest/
russiarunning_SUPER КИНО СЕРИЯ_2026-03-22	https://russiarunning.com/event/SUPERKINOSERIYa2zabeg/
russiarunning_МУЛЬТИ СЕРИЯ _ 101 ДАЛМАТИНЕЦ 🐇🐅🦜_2026-03-22	https://russiarunning.com/event/SUPERMULTISERIYa/
russiarunning_Соревнования по плаванию "Батыр: первая волна"_2026-03-22	https://russiarunning.com/event/springswim2026/
russiarunning_Забег-полумарафон "РУССКИЕ ВЁРСТЫ"_2026-03-22	https://russiarunning.com/event/ZabegpolumarafonRUSSKIEVYoRSTY/
russiarunning_Тренировочный тур во Вьетнам_2026-03-22	https://russiarunning.com/event/vietnam26/
russiarunning_Приключение на Кавказских Минеральных Водах 25.03.2026_2026-03-25	https://russiarunning.com/event/PriklyuchenienaKavkazskikhMineralnykhVodakh25032026/
russiarunning_ЭФЕС УЛЬТРАТРЕЙЛ 2026_2026-03-27	https://russiarunning.com/event/ephesusultratrail2026/
russiarunning_52-й Мурманский лыжный марафон_2026-03-28	https://russiarunning.com/event/52MLM/
russiarunning_Фитнес-гонка CRACE | HYROX 28_03_2026-03-28	https://russiarunning.com/event/FitnessraceCRACEHYROX2803/
russiarunning_«ТРЕЙЛ-МАРАФОН гандикап «Золотой слиток АБРАУ»2026» _2026-03-28	https://russiarunning.com/event/TREYLMARAFONgandikapZolotoyslitokABRAU2026/
russiarunning_Дейтинг-тур в Тульскую область_2026-03-28	https://russiarunning.com/event/date2803/
russiarunning_Стальной Характер Холод Когалым 2026_2026-03-28	https://russiarunning.com/event/StalnoyKharakterKogalym2026/
russiarunning_SUPER МУЛЬТИ СЕРИЯ  🐇🐅🦜_2026-03-28	https://russiarunning.com/event/MULTISERIYaDISNEY101DALMATINETs/
russiarunning_Полумарафон Generali Prague Half Marathon_2026-03-28	https://russiarunning.com/event/SportpaketnaGeneraliPragueHalfMarathon/
russiarunning_SUPER ЗАБЕГ_2026-03-28	https://russiarunning.com/event/SUPERZABEG2026/
russiarunning_500 ПОЛУМАРАФОН ДМИТРИЯ РОДНИКОВСКОГО_2026-03-28	https://russiarunning.com/event/500POLUMARAFONDMITRIYaRODNIKOVSKOGO/
russiarunning_Благотворительный забег исполнения желаний KAVKAZ.RUN 2026_2026-03-29	https://russiarunning.com/event/BlagotvoritelnyyzabegispolneniyazhelaniyKAVKAZRUN2026/
russiarunning_Гонка с препятствиями ЁZh Extreme Race_2026-03-29	https://russiarunning.com/event/YoZhExtremeSPRINGRace2026/
russiarunning_Забег "Акварель" 2026_2026-03-29	https://russiarunning.com/event/AquarelleRun2026/
russiarunning_Офлайн и онлайн Любительский забег в помощь животным 3, 5, 10км Фили - 29.03 Run With Love_2026-03-29	https://russiarunning.com/event/Fili2903/
russiarunning_Скоростная Десятка 2026_2026-03-29	https://russiarunning.com/event/SkorostnayaDesyatka2026/
russiarunning_Ночной трейл EZH NIGHT TRAIL_2026-03-29	https://russiarunning.com/event/EZHNIGHTTRAIL/
russiarunning_Каникросс с препятствиями GAVKI RACE_2026-03-29	https://russiarunning.com/event/GAVKISPRINGRACE2026/
russiarunning_ФЕСТИВАЛЬ МАРАФОНОВ  _ 1 день _ посвящённый СТРЕЛЬБЕ ИЗ ЛУКА_2026-03-30	https://russiarunning.com/event/FESTIVALMARAFONOV1DENSTRELBAIZLUKA/
russiarunning_Забег-марафон "Всемирный день Бега" _2026-04-01	https://russiarunning.com/event/ZabegpolumarafonVsemirnyydenBega3/
russiarunning_ФЕСТИВАЛЬ МАРАФОНОВ _ 2 день _ посвящённый БАСКЕТБОЛУ_2026-03-31	https://russiarunning.com/event/FESTIVALMARAFONOVOLIMPIADASEUL882DENBASKETBOL/
russiarunning_ФЕСТИВАЛЬ МАРАФОНОВ _ 3 день _ посвящённый БОКСУ_2026-04-01	https://russiarunning.com/event/FESTIVALMARAFONOVOLIMPIADASEUL881DENBOKS/
russiarunning_Беговой кемп в Турции, Анталия 01.04.2026_2026-04-01	https://russiarunning.com/event/BegovoykempvTurtsiiAntaliya01042026/
russiarunning_ФЕСТИВАЛЬ МАРАФОНОВ _ 4 день _ посвящённый ГРЕБЛЕ НА БАЙДАРКАХ И КАНОЭ_2026-04-02	https://russiarunning.com/event/FESTIVALMARAFONOVOLIMPIADASEUL884DENGREBLYaNABAYDARKAKhIKANOE/
russiarunning_XIII МЕЖДУНАРОДНЫЙ ЮГОРСКИЙ ЛЫЖНЫЙ МАРАФОН "UGRA SKI" _2026-04-04	https://russiarunning.com/event/XIIIMEZhDUNARODNYYYuGORSKIYLYZhNYYMARAFONUGRASKI/
russiarunning_АЛЬФА-БАНК Сириус Автодром. Велогонки._2026-04-03	https://russiarunning.com/event/VelogonkiSiriusAutodrom2026/
russiarunning_XVIII Партнерская конференция Russia Running и Всероссийской федерации легкой атлетики в сфере массового спорта _2026-04-03	https://russiarunning.com/event/XVIIIPartnerskayakonferentsiyaorganizatorovRUSSIARUNNING0304042026/
russiarunning_АЛЬФА-БАНК Сириус Автодром_2026-04-03	https://russiarunning.com/event/SiriusAutodrom2026/
russiarunning_ФЕСТИВАЛЬ МАРАФОНОВ _ 5 день _ посвящённый ДЗЮДО_2026-04-03	https://russiarunning.com/event/FESTIVALMARAFONOVOLIMPIADASEUL885DENDZYuDO/
russiarunning_Вечерний пробег Сонгкран_2026-04-04	https://russiarunning.com/event/370/
russiarunning_КРЮКОВО МАРАФОН (ЗЕЛЕНОГРАД)_2026-04-04	https://russiarunning.com/event/KRYuKOVOMARAFONZELENOGRAD2026/
russiarunning_Тренировочный тур в Дагестан_2026-04-04	https://russiarunning.com/event/TrenirovochnyyturvDagestan/
russiarunning_Бештаугорский Крест 2026_2026-04-04	https://russiarunning.com/event/BeshtaugorskiyKrest2026/
russiarunning_RUNTALYA 2026_2026-04-05	https://russiarunning.com/event/runtalya2026/
russiarunning_МАТУШКИНО МАРАФОН (ЗЕЛЕНОГРАД)_2026-04-05	https://russiarunning.com/event/MATUShKINOMARAFONZELENOGRAD2026/
russiarunning_ФЕСТИВАЛЬ МАРАФОНОВ _ 6 день _ посвящённый СОВРЕМЕННОМУ ПЯТИБОРЬЮ_2026-04-06	https://russiarunning.com/event/FESTIVALMARAFONOV6DENSOVREMENNOEPYaTIBORE/
russiarunning_Беговой кемп в Италии_2026-04-07	https://russiarunning.com/event/garda_run_april_07_13042026/
russiarunning_ФЕСТИВАЛЬ МАРАФОНОВ _ 7 день _ посвящённый АКАДЕМИЧЕСКОЙ ГРЕБЛЕ_2026-04-07	https://russiarunning.com/event/FESTIVALMARAFONOV7DENAKADEMIChESKAYaGREBLYa/
russiarunning_ФЕСТИВАЛЬ МАРАФОНОВ _ 8 день _ посвящённый СТРЕЛЬБЕ_2026-04-08	https://russiarunning.com/event/FESTIVALMARAFONOV8DENSTRELBA/
russiarunning_Тренировочный тур в Дагестан. Кемп к забегу Дагестан Wild Trail_2026-04-09	https://russiarunning.com/event/dagestan042026/
russiarunning_ФЕСТИВАЛЬ МАРАФОНОВ _ 9 день _ посвящённый ПЛАВАНИЮ_2026-04-09	https://russiarunning.com/event/FESTIVALMARAFONOV9DENPLAVANIE/
russiarunning_Марафон Lake Garda 42 км_2026-04-10	https://russiarunning.com/event/lakegarda42/
russiarunning_ФЕСТИВАЛЬ МАРАФОНОВ _ 10 день _ посвящённый ВЕЛОСПОРТУ_2026-04-10	https://russiarunning.com/event/FESTIVALMARAFONOV10DENVELOSPORT/
russiarunning_Тренировочный тур в Кисловодск_2026-04-11	https://russiarunning.com/event/kislovodsk26/
russiarunning_Пасхальный марафон 🥚 Яйцо Фаберже 🐣 Ландыши, ONLINE, #Охота_за_медалями_2026-04-12	https://russiarunning.com/event/FabergeEggLiliesMarathonONLINE/
russiarunning_САВЁЛКИ МАРАФОН (ЗЕЛЕНОГРАД)_2026-04-11	https://russiarunning.com/event/SAVYoLKIMARAFONZELENOGRAD2026/
russiarunning_Пятюня Космическая_2026-04-12	https://russiarunning.com/event/PyatyunyaKosmicheskaya/
russiarunning_«МАРАФОН БЕЛОЙ СКАЛЫ «ДИКИЕ ПИОНЫ»_2026-04-12	https://russiarunning.com/event/MARAFONBELOYSKALYDIKIEPIONY/
russiarunning_ВЕСЕННИЙ ПРОБЕГ_2026-04-12	https://russiarunning.com/event/Vesenniyprobeg2026/
russiarunning_РЯЗАНЬ: ОТКРЫТИЕ СЕЗОНА _2026-04-12	https://russiarunning.com/event/LAS26/
russiarunning_Мама, Я Бегу! (Усадьба Алтуфьево) _2026-04-12	https://russiarunning.com/event/MamaYaBeguUsadbaAltufevo2/
russiarunning_ПОЛУМАРАФОН БАЙКОНУР «Гагаринский Старт»_2026-04-12	https://russiarunning.com/event/KOSMOSBAIKONUR2026/
russiarunning_ДЕТСКАЯ и ЮНИОРСКАЯ ЛИГИ. АПРЕЛЬ -2026_2026-04-12	https://russiarunning.com/event/DETSKAYaiYuNIORSKAYaLIGIAPREL2026/
russiarunning_СТАРОЕ КРЮКОВО МАРАФОН (ЗЕЛЕНОГРАД)_2026-04-12	https://russiarunning.com/event/STAROEKRYuKOVOMARAFONZELENOGRAD2026/
russiarunning_ФЕСТИВАЛЬ МАРАФОНОВ _ 11 день _ посвящённый КОННОМУ СПОРТУ_2026-04-13	https://russiarunning.com/event/FESTIVALMARAFONOV11DENKONKUR/
russiarunning_ФЕСТИВАЛЬ МАРАФОНОВ _ 12 день _ посвящённый ФЕХТОВАНИЮ_2026-04-14	https://russiarunning.com/event/FESTIVALMARAFONOV12DENFEKhTOVANIE/
russiarunning_ФЕСТИВАЛЬ МАРАФОНОВ _ 13 день _ посвящённый ФУТБОЛУ_2026-04-15	https://russiarunning.com/event/FESTIVALMARAFONOV13DENFUTBOL/
russiarunning_ФЕСТИВАЛЬ МАРАФОНОВ _ 14 день _ посвящённый СПОРТИВНОЙ ГИМНАСТИКЕ_2026-04-16	https://russiarunning.com/event/FESTIVALMARAFONOV14DENSPORTIVNAYaGIMNASTIKA/
russiarunning_ХехцирТрейл. Цветы Багульника._2026-04-18	https://russiarunning.com/event/Trail27Bagulnik2026/
russiarunning_ФЕСТИВАЛЬ МАРАФОНОВ _ 15 день _ посвящённый НАСТОЛЬНОМУ ТЕННИСУ_2026-04-17	https://russiarunning.com/event/FESTIVALMARAFONOV15DENNASTOLNYYTENNIS/
russiarunning_Марафон "БЕГИ"  _2026-04-17	https://russiarunning.com/event/marathonRUN/
russiarunning_Открытый чемпионат по Апхилу_2026-04-18	https://russiarunning.com/event/OtkrytyychempionatpoApkhilu/
russiarunning_Бегущий экскурсовод: Беговая экскурсия по центру Петербурга 18 апреля_2026-04-18	https://russiarunning.com/event/BegushchiyekskursovodBegovayaekskursiyapotsentruPeterburga18aprelya/
russiarunning_Городская ультра Уфимское ожерелье. 1 этап_2026-04-18	https://russiarunning.com/event/ufacityultra2026/
russiarunning_Бежим вместе на Дубравной — ночной трейл_2026-04-18	https://russiarunning.com/event/bezhimvmeste2026/
russiarunning_Бежим вместе на Дубравной — дневной трейл_2026-04-19	https://russiarunning.com/event/BezhimvmestenaDubravnoydnevnoytreyl/
russiarunning_СИЛИНО МАРАФОН (ЗЕЛЕНОГРАД)_2026-04-18	https://russiarunning.com/event/SILINOMARAFONZELENOGRAD2026/
russiarunning_37-ой Волгоград Марафон 2026_2026-04-18	https://russiarunning.com/event/VolgogradMarafon2026/
russiarunning_Трейл Куцай Весенний_2026-04-18	https://russiarunning.com/event/TreylKutsayvesenniy/
russiarunning_Стальной Характер Астрахань 2026_2026-04-18	https://russiarunning.com/event/StalnoyKharakterAstrakhan2026/
russiarunning_39-й Белградский Марафон_2026-04-18	https://russiarunning.com/event/belgrademarathon2026/
russiarunning_Трейл "ДЖИНАЛ" 2026_2026-04-18	https://russiarunning.com/event/TreylDZhINAL2026/
russiarunning_21-й Стамбульский Полумарафон_2026-04-19	https://russiarunning.com/event/Istanbulhalfmarathon2026/
russiarunning_КОСМИЧЕСКИЙ ПОЛУМАРАФОН г. Самара 2026_2026-04-19	https://russiarunning.com/event/SAMARSKIYKOSMIChESKIYPOLUMARAFONGSAMARA2026/
russiarunning_Love and Space Half Marathon 2026_2026-04-19	https://russiarunning.com/event/lovespace2026/
russiarunning_Лесобег Весна 2026_2026-04-19	https://russiarunning.com/event/LesobegVesna2026/
russiarunning_Арена Полумарафон 2026_2026-04-19	https://russiarunning.com/event/ArenaPolumarafon2026/
russiarunning_Забег-полумарафон "Марьинская Стрела"_2026-04-19	https://russiarunning.com/event/ZabegpolumarafonMarinskayaStrela11/
russiarunning_СПАРТАКОВСКАЯ МИЛЯ. СЧАСТЬЕ ЕСТЬ 2026                      (1-й спутник Пермского марафона)_2026-04-19	https://russiarunning.com/event/SPARTAKOVSKAYaMILYaSChASTEEST2026/
russiarunning_Эстафета Весна 2026_2026-04-19	https://russiarunning.com/event/rls2026/
russiarunning_«КАШТАК TRAIL- ВЕСНА 2026» 19.04.2026_2026-04-19	https://russiarunning.com/event/KAShTAKTRAILVESNA202619042026/
russiarunning_ФЕСТИВАЛЬ МАРАФОНОВ _ 16 день _ посвящённый БОЛЬШОМУ ТЕННИСУ_2026-04-20	https://russiarunning.com/event/FESTIVALMARAFONOV16DENBOLShOYTENNIS/
russiarunning_ФЕСТИВАЛЬ МАРАФОНОВ _ 17 день _ посвящённый ВОЛЕЙБОЛУ_2026-04-21	https://russiarunning.com/event/FESTIVALMARAFONOV17DENVOLEYBOL/
russiarunning_ФЕСТИВАЛЬ МАРАФОНОВ _ 18 день _ посвящённый ВОДНОМУ ПОЛО_2026-04-22	https://russiarunning.com/event/FESTIVALMARAFONOV18DENVODNOEPOLO/
russiarunning_IX Сверхмарафон "Бег счастья"_2026-04-23	https://russiarunning.com/event/RunofHappiness/
russiarunning_ФЕСТИВАЛЬ МАРАФОНОВ _ 19 день _ посвящённый ТЯЖЕЛОЙ АТЛЕТИКЕ_2026-04-23	https://russiarunning.com/event/FESTIVALMARAFONOV19DENTYaZhELAYaATLETIKA/
russiarunning_ФЕСТИВАЛЬ МАРАФОНОВ _ 20 день _ посвящённый ГАНДБОЛУ_2026-04-24	https://russiarunning.com/event/FESTIVALMARAFONOV20DENGANDBOL/
russiarunning_АСТРУМ СИБАЙСКИЙ ПОЛУМАРАФОН 2026_2026-04-25	https://russiarunning.com/event/sibai2026/
russiarunning_Вечерний забег "ФОНАРИКИ ЖЕЛАНИЙ" _2026-04-25	https://russiarunning.com/event/VecherniyzabegFONARIKIZhELANIY3/
russiarunning_Беговой фестиваль «Весенняя гроза»_2026-04-25	https://russiarunning.com/event/BegovoyfestivalVesennyayagroza/
russiarunning_Пятигорский полумарафон KAVKAZ.RUN 2026_2026-04-25	https://russiarunning.com/event/PyatigorskiypolumarafonKAVKAZRUN2026/
russiarunning_WOLF TRAIL (ВОЛЧЬИМИ ТРОПАМИ) BACKYARD ULTRA 2026_2026-04-25	https://russiarunning.com/event/WOLFTRAIL2026/
russiarunning_ГОНКА ТИТАНОВ_2026-04-26	https://russiarunning.com/event/GONKATITANOV/
russiarunning_Румболово Трейл | GoodTrail_2026-04-26	https://russiarunning.com/event/rumbolovotrail/
russiarunning_СЕРДЦЕ СТОЛИЦЫ 2026 - трейл в сердце Южно-Уральской столицы_2026-04-26	https://russiarunning.com/event/SERDTsESTOLITsYtreylvserdtseyuzhnouralskoystolitsy2026/
russiarunning_Пасхальный забег 2026_2026-04-26	https://russiarunning.com/event/ER26/
russiarunning_ЗАБЕГ "МАЙСКАЯ ГРОЗА" 2026_2026-04-26	https://russiarunning.com/event/ZABEGMAYSKAYaGROZA2026/
russiarunning_Забег 8 городов. Волгоград _2026-04-26	https://russiarunning.com/event/Zabeg8gorodovVolgograd2026/
russiarunning_Забег 8 городов. Краснодар_2026-04-26	https://russiarunning.com/event/Zabeg8gorodovKrasnodar/
russiarunning_ФЕСТИВАЛЬ МАРАФОНОВ _ 21 день _ посвящённый ХОККЕЮ НА ТРАВЕ_2026-04-27	https://russiarunning.com/event/FESTIVALMARAFONOV21DENKhOKKEYNATRAVE/
russiarunning_ФЕСТИВАЛЬ МАРАФОНОВ _ 22 день _ посвящённый БОРЬБЕ_2026-04-28	https://russiarunning.com/event/FESTIVALMARAFONOV22DENBORBA/
russiarunning_ФЕСТИВАЛЬ МАРАФОНОВ _ 23 день _ посвящённый ПАРУСНОМУ СПОРТУ_2026-04-29	https://russiarunning.com/event/FESTIVALMARAFONOV23DENPARUSNYYSPORT/
russiarunning_ФЕСТИВАЛЬ МАРАФОНОВ _ 24 день _ посвящённый ЛЁГКОЙ АТЛЕТИКЕ_2026-04-30	https://russiarunning.com/event/FESTIVALMARAFONOV24DENLYoGKAYaATLETIKA/
russiarunning_Мама, Я Бегу! (Усадьба Михалково)_2026-05-01	https://russiarunning.com/event/MamaYaBeguUsadbaMikhalkovo/
russiarunning_XI Тутаевский полумарафон «Май. Мир. Молодость» – 2026_2026-05-01	https://russiarunning.com/event/BZK_Tutaev_26/
russiarunning_Вело-тур в г.Мышкин. Ярославская область_2026-05-01	https://russiarunning.com/event/mishkin26/
russiarunning_Тренировочный тур в Казахстан. Подготовка к ультрамарафону TENGRI ULTRA_2026-05-01	https://russiarunning.com/event/kazahstan26/
russiarunning_ФЕСТИВАЛЬ МАРАФОНОВ _ 25 день _ ЗАКРЫТИЕ (ФИНАЛ)_2026-05-01	https://russiarunning.com/event/FESTIVALMARAFONOV25DENZAKRYTIEFINAL/
russiarunning_Стальной Характер Волгоград 2026_2026-05-02	https://russiarunning.com/event/StalnoyKharakterVolgograd2026/
russiarunning_II Дудергоф трейл Спортмастер ПРО, посвящённый Празднику весны и труда_2026-05-02	https://russiarunning.com/event/IIDuderhofTrailSportmasterPROdedicatedtotheSpringandLaborFestival/
russiarunning_БСТ Ультра Трейл 2026_2026-05-02	https://russiarunning.com/event/bst2026/
russiarunning_WBU Армения_2026-05-02	https://russiarunning.com/event/wbu2026armenia/
russiarunning_★ЛЕНИНГРАД 82 ★ VIII Пискаревский международный Полумарафон (посвященный 82-летию полного снятия блокады Ленинграда и 81-летию Победы в Великой отечественной войне 1941-1945 гг.)_2026-05-03	https://russiarunning.com/event/PiskarevskyPMVictory2026/
russiarunning_КИНО СЕРИЯ _ АВАТАР 🎭📽️🎬_2026-05-05	https://russiarunning.com/event/KINOSERIYaAVATAR/
russiarunning_ОСТАНКИНСКИЙ МАРАФОН_2026-05-06	https://russiarunning.com/event/OSTANKINSKIYMARAFON3zabeg/
russiarunning_Велокемп в Вене, Австрия_2026-05-06	https://russiarunning.com/event/biketourinvienna_6_10_may_2026/
russiarunning_Триатлон на Кубок Губернатора Санкт-Петербурга на дистанцию "суперспринт", 3 этап_2026-05-09	https://russiarunning.com/event/st_petersburg_indoor26_stage3/
russiarunning_Тренировочный тур в Сочи_2026-05-09	https://russiarunning.com/event/sochi26/
russiarunning_Ясная Поляна Трейл_2026-05-09	https://russiarunning.com/event/YasnayaPolyanaTreyl/
russiarunning_МАНГАЗЕЯ ТРИ ГОРЫ_2026-05-09	https://russiarunning.com/event/3mountains26/
russiarunning_забег-полумарафон "Братский забег"_2026-05-09	https://russiarunning.com/event/Bratskiyzabeg8/
russiarunning_Кирилловский полумарафон - 2026_2026-05-10	https://russiarunning.com/event/Kirillovskiypolumarafon2026/
russiarunning_Царскосельский Марафон 2026_2026-05-10	https://russiarunning.com/event/TsarskoselskiyMarafon2026/
russiarunning_Бежим вместе в Анкудиновском лесу_2026-05-10	https://russiarunning.com/event/BezhimvmestevAnkudinovskomlesu/
russiarunning_БЕГ В МУДРОСТЬ _ ПОСВЯЩЁННЫЙ ДНЮ ПОБЕДЫ_2026-05-10	https://russiarunning.com/event/BEGVMUDROSTPOSVYaShchYoNNYYDNYuPOBEDY2026/
russiarunning_Забег-полумарафон "АДСКИЕ ГОРКИ"_2026-05-11	https://russiarunning.com/event/ZabegpolumarafonADSKIEGORKI/
russiarunning_КИНО СЕРИЯ _ КРЕПКИЙ ОРЕШЕК 🎭📽️🎬_2026-05-12	https://russiarunning.com/event/KINOSERIYaKREPKIYOREShEK/
russiarunning_НАГАТИНСКИЙ ЗАТОН МАРАФОН_2026-05-13	https://russiarunning.com/event/NAGATINSKIYZATONMARAFON2zabeg/
russiarunning_КИНО СЕРИЯ _ ЧУЖОЙ 🎭📽️🎬_2026-05-14	https://russiarunning.com/event/KINOSERIYaChUZhOY/
russiarunning_КУЗЬМИНКИ МАРАФОН_2026-05-14	https://russiarunning.com/event/KUZMINKIMARAFON2zabeg/
russiarunning_O-TRAIL Марафон Алания 2026_2026-05-16	https://russiarunning.com/event/OTRAILMarafonAlaniya2026/
russiarunning_Забег по пересеченной местности "По тропам предков" 2026_2026-05-16	https://russiarunning.com/event/ZabegpoperesechennoymestnostiPotropampredkov2026/
russiarunning_Спортивный фестиваль «Кубок САПКЛАБ»_2026-05-16	https://russiarunning.com/event/kuboksupclub26/
russiarunning_Стальной характер Воронеж 2026_2026-05-16	https://russiarunning.com/event/StalnoykharakterVoronezh2026/
russiarunning_Забег на трамплин HARD RUN HILL 2026_2026-05-16	https://russiarunning.com/event/ZabegnatramplinHARDRUNHILL2026/
russiarunning_РУТС Тобольск_2026-05-17	https://russiarunning.com/event/RUTSTobolsk2026/
russiarunning_Забег-полумарафон "LOW POINT__114.2" _2026-05-17	https://russiarunning.com/event/ZabegpolumarafonLOWPOINT11422/
russiarunning_Домодедово трейл_2026-05-17	https://russiarunning.com/event/Domodedovotrail/
russiarunning_XI Мышкинский полумарафон «По шести холмам» – 2026_2026-05-17	https://russiarunning.com/event/BZK_Myshkin_26/
russiarunning_Crazy Trail Dunilovo Безумный трейл_2026-05-17	https://russiarunning.com/event/CrazyTrailDunilovoBezumnyytreyl/
russiarunning_КИНО СЕРИЯ _ ОСТРОВ ПРОКЛЯТЫХ 🎭📽️🎬_2026-05-19	https://russiarunning.com/event/KINOSERIYaOSTROVPROKLYaTYKh/
russiarunning_КРЫЛАТСКОЕ МАРАФОН_2026-05-20	https://russiarunning.com/event/KRYLATSKOEMARAFON5zabeg/
russiarunning_КИНО СЕРИЯ _ АМЕРИКАНСКАЯ ИСТОРИЯ Х 🎭📽️🎬_2026-05-21	https://russiarunning.com/event/KINOSERIYaAMERIKANSKAYaISTORIYaKh/
russiarunning_ВСЕРОССИЙСКИЙ ПОЛУМАРАФОН ЗАБЕГ.РФ ГОРОД ИЖЕВСК_2026-05-23	https://russiarunning.com/event/ZABEGRFIZHEVSK/
russiarunning_Тюменский полумарафон/ЗаБег.РФ 2026_2026-05-23	https://russiarunning.com/event/TyumenskiypolumarafonZaBegRF2026/
russiarunning_ЗаБег.РФ Республика Алтай 2026_2026-05-23	https://russiarunning.com/event/ZaBegRFRespublikaAltay2026/
russiarunning_ЗаБег.РФ Тула 2026_2026-05-23	https://russiarunning.com/event/tpm2026/
russiarunning_Воронежский полумарафон ЗаБег РФ 2026_2026-05-23	https://russiarunning.com/event/VORONEZhSKIYPOLUMARAFONZABEGRF202623052026/
russiarunning_Всероссийский полумарафон "Забег.РФ" Ленинградская область (Гатчина) 2026_2026-05-23	https://russiarunning.com/event/zabegrflenoblast2026/
russiarunning_Пермский полумарафон ЗаБег РФ 2026_2026-05-23	https://russiarunning.com/event/zabegrfperm2026/
russiarunning_Благотворительный полумарафон БЕГИ, ГЕРОЙ! 2026_2026-05-23	https://russiarunning.com/event/BlagotvoritelnyypolumarafonBEGIGEROY2026/
russiarunning_Оренбургский полумарафон ЗаБег.РФ 2026_2026-05-23	https://russiarunning.com/event/Orenburgskiypolumarafon2026/
russiarunning_O-TRAIL Стрижамент ВЭС 2026_2026-05-24	https://russiarunning.com/event/OTRAILStrizhamentVES2026/
russiarunning_RunKarjala / Забег.РФ 2026_2026-05-23	https://russiarunning.com/event/zabegptz2026/
russiarunning_Детский забег БЕГИ, ГЕРОЙ! 2026_2026-05-23	https://russiarunning.com/event/DetskiyzabegBEGIGEROY2026/
russiarunning_Волгоградский полумарафон ЗаБег.РФ_2026-05-23	https://russiarunning.com/event/VOLGARUN2026/
russiarunning_Ставропольский полумарафон KAVKAZ.RUN / ЗАБЕГ.РФ 2026_2026-05-23	https://russiarunning.com/event/StavropolskiypolumarafonKAVKAZRUNZABEGRF2026/
russiarunning_Забег с препятствиями «Медвежья гонка»_2026-05-24	https://russiarunning.com/event/ZabegsprepyatstviyamiMedvezhyagonka24052026/
russiarunning_КИНО СЕРИЯ _ МОСКВА СЛЕЗАМ НЕ ВЕРИТ 🎭📽️🎬_2026-05-26	https://russiarunning.com/event/KINOSERIYaMOSKVASLEZAMNEVERIT/
russiarunning_РАМЕНКИ МАРАФОН_2026-05-27	https://russiarunning.com/event/RAMENKIMARAFON2zabeg/
russiarunning_ГОРОДА РОССИИ _ МОСКВА_2026-05-28	https://russiarunning.com/event/GORODAROSSIIMOSKVA/
russiarunning_Вело-тур в г.Калуга. Калужская область_2026-05-29	https://russiarunning.com/event/kalyga26/
russiarunning_Первоуральск Опен 2026 (Весна)_2026-05-29	https://russiarunning.com/event/PervouralskOpen2026Vesna/
russiarunning_Забеги-спутники «СПБ БЭКЪЯРД УЛЬТРА 2026»_2026-05-30	https://russiarunning.com/event/spbbackyardultragatchina2026/
russiarunning_АКУША ТРЕЙЛ РАН_2026-05-30	https://russiarunning.com/event/AKUSHATRAILRUN/
russiarunning_XI Переславский марафон «Александровские вёрсты» – 2026_2026-05-31	https://russiarunning.com/event/BZK_Pereslavl_26/
russiarunning_АРГАМАК ТРЕЙЛ 2026_2026-05-31	https://russiarunning.com/event/argamak2026/
russiarunning_Здравствуй, ЛЕТО! _2026-05-31	https://russiarunning.com/event/ZdravstvuyLETO2026/
russiarunning_Эстафетный забег "Бегом по Питеру 2026. С запада на восток"_2026-05-31	https://russiarunning.com/event/BegompoPiteru2026/
russiarunning_КИНО СЕРИЯ _ ИГРА В КАЛЬМАРА 🎭📽️🎬_2026-06-02	https://russiarunning.com/event/KINOSERIYaIGRAVKALMARA/
russiarunning_СЕВЕРНОЕ БУТОВО МАРАФОН_2026-06-03	https://russiarunning.com/event/SEVERNOEBUTOVOMARAFON/
russiarunning_СУБЪЕКТЫ РОССИЙСКОЙ ФЕДЕРАЦИИ _ РЕСПУБЛИКА АДЫГЕЯ_2026-06-04	https://russiarunning.com/event/SUBEKTYROSSIYSKOYFEDERATsIIADYGEYa/
russiarunning_РУТС Пермь_2026-06-06	https://russiarunning.com/event/RUTSPerm2026/
russiarunning_Абхазия трейл_2026-06-06	https://russiarunning.com/event/Abkhazian_trail2026/
russiarunning_Восхождение на Килиманджаро. Маршрут Мачаме_2026-06-06	https://russiarunning.com/event/VoskhozhdenienaKilimandzharoMarshrutMachame/
russiarunning_Каникросс с препятствиями GAVKI RACE 2026_2026-06-06	https://russiarunning.com/event/GAVKIRACE2026/
russiarunning_Заплывы SWIMSTAR MINSK 2026_2026-06-06	https://russiarunning.com/event/ZaplyvySWIMSTARMINSK2026/
russiarunning_«IV Открытое первенство для любителей бега на стадионе Спортмастер ПРО, посвящённое Дню России»_2026-06-07	https://russiarunning.com/event/IVOpenChampionshipforRunningLoversattheSportmasterPROStadiumDedicatedtoRussiaDay/
russiarunning_Чемпионат Пермского края по трейлу "Обгоняя ветер"_2026-06-07	https://russiarunning.com/event/ObgonyayaveterLeto2026/
russiarunning_Триатлон 113/ OLYMPIC IRONSTAR MINSK 2026_2026-06-07	https://russiarunning.com/event/IRONSTARMINSKTRIATHLON2026/
russiarunning_Хайкинг вокруг горы Сечеда. Долина Val Gardena, Италия_2026-06-08	https://russiarunning.com/event/Hiking_Seceda_June_08_14062026/
russiarunning_КИНО СЕРИЯ _ ОХОТНИКИ ЗА ПРИВИДЕНИЯМИ 2 🎭📽️🎬_2026-06-09	https://russiarunning.com/event/KINOSERIYaZELYoNAYaMILYa/
russiarunning_СЕВЕРНОЕ ИЗМАЙЛОВО МАРАФОН_2026-06-10	https://russiarunning.com/event/SEVERNOEIZMAYLOVOMARAFON/
russiarunning_X Полумарафон «Здорово, Кострома!» – 2026_2026-06-12	https://russiarunning.com/event/BZK_Kostroma_26/
russiarunning_Вело-тур Лев Толстой. Тульская область_2026-06-12	https://russiarunning.com/event/lev26/
russiarunning_VII Бисертский марафон_2026-06-12	https://russiarunning.com/event/VIIBisertskiymarafon12062026g/
russiarunning_ЭКИДЕН 42.195/6 — 2026_2026-06-13	https://russiarunning.com/event/EKIDEN4219562026/
russiarunning_Восьмой Чупинский полумарафон "Северная Карелия - у Белого моря 2026" 13.06.2026_2026-06-13	https://russiarunning.com/event/VOSMOYChUPINSKIYPOLUMARAFONSEVERNAYaKARELIYaUBELOGOMORYa202613062025/
russiarunning_Динамовская Миля 2026_2026-06-13	https://russiarunning.com/event/DinamovskayaMilya2026/
russiarunning_ХXVII Тюменский марафон "Врата Сибири"_2026-06-13	https://russiarunning.com/event/TyumenskiymarafonVrataSibiri/
russiarunning_БЕГ В ПОМОЩЬ _ ПОСВЯЩЁННЫЙ ДНЮ РОССИИ_2026-06-13	https://russiarunning.com/event/BEGVPOMOShchPOSVYaShchYoNNYYDNYuROSSII/
russiarunning_Забег-полумарафон "Покровское-Стрешнево"_2026-06-14	https://russiarunning.com/event/PokrovskoeStreshnevo/
russiarunning_Хайкинг кемп в Италии_2026-06-15	https://russiarunning.com/event/hiking_italy_june_15_21062026/
russiarunning_КИНО СЕРИЯ _ МОЛЧАНИЕ ЯГНЯТ 🎭📽️🎬_2026-06-16	https://russiarunning.com/event/KINOSERIYaMOLChANIEYaGNYaT/
russiarunning_СЕВЕРНОЕ МЕДВЕДКОВО МАРАФОН_2026-06-17	https://russiarunning.com/event/SEVERNOEMEDVEDKOVOMARAFON/
russiarunning_ОЛИМПИЙСКАЯ СЕРИЯ _ ИРИНА РОДНИНА_2026-06-18	https://russiarunning.com/event/OLIMPIYSKAYaSERIYaIRINARODNINA/
russiarunning_Кросс "MagadanRun" 2026     лыжная трасса, г. Магадан_2026-06-20	https://russiarunning.com/event/KrossMagadanRun2026/
russiarunning_Через горы к морю за 1 день_2026-06-19	https://russiarunning.com/event/ChEREZGORYKMORYuZA1DEN/
russiarunning_БАТЫР БЭКЪЯРД ФЕСТ 2026_2026-06-19	https://russiarunning.com/event/batyrbackyard2026/
russiarunning_Тренировочный кемп по вело  и триатлону в Италии, Доломиты_2026-06-19	https://russiarunning.com/event/triathlon_italy_june_19_27062026/
russiarunning_BEAUTYRUN KAVKAZ.RUN 2026_2026-06-20	https://russiarunning.com/event/BEAUTYRUNKAVKAZRUN2026/
russiarunning_Нутрия Трейл + плавание + сап-гонка_2026-06-20	https://russiarunning.com/event/NutriyaTreylplavaniesapgonka/
russiarunning_Стальной Характер Сургут 2026_2026-06-20	https://russiarunning.com/event/StalnoyKharakterSurgut2026/
russiarunning_Триатлон "МЕДНЫЙ ВСАДНИК" 51.5_2026-06-20	https://russiarunning.com/event/triathlon_51_5/
russiarunning_Фестиваль спорта "Серебряный остров" 2026_2026-06-20	https://russiarunning.com/event/FestivalsportaSerebryanyyostrov/
russiarunning_Тренировочный тур в Архыз_2026-06-20	https://russiarunning.com/event/arkhiz2026/
russiarunning_ 41 Архангельский Марафон "ГАНДВИК"_2026-06-20	https://russiarunning.com/event/0926/
russiarunning_Ночной полумарафон "СЕРЫЕ НОЧИ" 2026_2026-06-20	https://russiarunning.com/event/NochnoypolumarafonSERYENOChI2026/
russiarunning_SWIMRUN KAVKAZ.RUN 2026_2026-06-20	https://russiarunning.com/event/SWIMRUNKAVKAZRUN2026/
russiarunning_Трейловый забег в рамках серии национальных забегов "ЭТНОРАН"  в Удмуртской Республике_2026-06-20	https://russiarunning.com/event/ETNORANYR/
russiarunning_VIII Международный Марафон ⛵ "Алые Паруса"_2026-06-21	https://russiarunning.com/event/SCARLETSAILS2026/
russiarunning_РУТС Нижний Новгород_2026-06-21	https://russiarunning.com/event/RUTSNN2026/
russiarunning_КИНО СЕРИЯ _ ГАРРИ ПОТТЕР И ТАЙНАЯ КОМНАТА 🎭📽️🎬_2026-06-23	https://russiarunning.com/event/KINOSERIYaGARRIPOTTERITAYNAYaKOMNATA/
russiarunning_СЕВЕРНОЕ ТУШИНО МАРАФОН_2026-06-24	https://russiarunning.com/event/SEVERNOETUShINOMARAFON/
russiarunning_ГОРОДА РОССИИ _ САНКТ-ПЕТЕРБУРГ_2026-06-25	https://russiarunning.com/event/GORODAROSSIISANKTPETERBURG/
russiarunning_Демино Фест_2026-06-26	https://russiarunning.com/event/DeminoFest/
russiarunning_ФЕСТИВАЛЬ ТРИАТЛОНА "ЭНЕРГИЯ РУССКОГО СЕВЕРА"_2026-06-26	https://russiarunning.com/event/energy2026/
russiarunning_Забег "Ночная пчела", поселок Палех Ивановская область_2026-06-27	https://russiarunning.com/event/ZabegNochnayapchelaposelokPalekhIvanovskayaoblast/
russiarunning_Фестиваль "КАМА sprint"_2026-06-27	https://russiarunning.com/event/FestivalKAMAsprint/
russiarunning_Республиканский спортивный фестиваль «Музыкальный триатлон»_2026-06-27	https://russiarunning.com/event/RespublikanskiysportivnyyfestivalMuzykalnyytriatlon/
russiarunning_Балтийский трейл «Белые ночи» 2026_2026-06-27	https://russiarunning.com/event/BaltiyskiytreylBelyenochi2026/
russiarunning_X Угличский полумарафон «Волжский берег» – 2026_2026-06-28	https://russiarunning.com/event/BZK_Uglich_26/
russiarunning_Фестиваль спорта "БЕГ НЕ ЗА ГОРАМИ FORREST TRAIL" 2026_2026-06-28	https://russiarunning.com/event/FestivalsportaBEGNEZAGORAMIFORRESTTRAIL2026/
russiarunning_КИНО СЕРИЯ _ БАРХАТНЫЕ РУЧКИ 🎭📽️🎬_2026-06-30	https://russiarunning.com/event/KINOSERIYaBARKhATNYERUChKI/
russiarunning_СЕВЕРНЫЙ МАРАФОН_2026-07-01	https://russiarunning.com/event/SEVERNYYMARAFON/
russiarunning_СУБЪЕКТЫ РОССИЙСКОЙ ФЕДЕРАЦИИ _ РЕСПУБЛИКА БУРЯТИЯ_2026-07-02	https://russiarunning.com/event/SUBEKTYROSSIYSKOYFEDERATsIIBURYaTIYa/
russiarunning_Maratona dles Dolomites_2026-07-03	https://russiarunning.com/event/MaratonadlesDolomites/
russiarunning_Восхождение на Казбек_2026-07-03	https://russiarunning.com/event/kazbek/
russiarunning_ Caucasus Ultra Trail 2026_2026-07-03	https://russiarunning.com/event/CaucasusUltraTrail2026/
russiarunning_Бегущий экскурсовод: УТРЕННЯЯ беговая экскурсия по центру Петербурга 03 июля_2026-07-03	https://russiarunning.com/event/BegushchiyekskursovodUTRENNYaYabegovayaekskursiyapotsentruPeterburga03iyulya/
russiarunning_Бегущий экскурсовод: ВЕЧЕРНЯЯ беговая экскурсия по центру Петербурга 03 июля_2026-07-03	https://russiarunning.com/event/BegushchiyekskursovodVEChERNYaYabegovayaekskursiyapotsentruPeterburga03iyulya/
russiarunning_X-WATERS UFA 2026_2026-07-03	https://russiarunning.com/event/XWATERSUFA/
russiarunning_GO RUN FEST URAL 2026 Трейловый фестиваль Южного Урала_2026-07-04	https://russiarunning.com/event/GORUNFESTIVAL2025TreylovyyfestivalYuzhnogoUrala/
russiarunning_Всероссийское беговое событие «Арктический марафон - 2026»_2026-07-04	https://russiarunning.com/event/ArcticMarathon_2026/
russiarunning_ФЕСТИВАЛЬ БЕГА КУДЫКИНА ГОРА ТРЕЙЛ 2026_2026-07-04	https://russiarunning.com/event/kudykina2026/
russiarunning_Стальной Характер Тобольск 2026_2026-07-04	https://russiarunning.com/event/StalnoyKharakterTobolsk2026/
russiarunning_Ежегодный детский фестиваль триатлона в Карачаево-Черкесской Республике "Айранята"_2026-07-04	https://russiarunning.com/event/EzhegodnyydetskiyfestivaltriatlonavKarachaevoCherkesskoyRespublikeAyranyata/
russiarunning_Велокемп в Бормио, Италия_2026-07-04	https://russiarunning.com/event/cycling_bormio_july_04_10072026/
russiarunning_Забег-полумарафон "День Семьи, Любви и Верности" _2026-07-05	https://russiarunning.com/event/ZabegpolumarafonDenSemiLyubviiVernosti2026/
russiarunning_Заплыв на открытой воде «KAMWATER 2026»_2026-07-05	https://russiarunning.com/event/kamwater2026/
russiarunning_КИНО СЕРИЯ _ НА ГРЕБНЕ ВОЛНЫ 🎭📽️🎬_2026-07-07	https://russiarunning.com/event/KINOSERIYaNAGREBNEVOLNY/
russiarunning_СОКОЛ МАРАФОН_2026-07-08	https://russiarunning.com/event/SOKOLMARAFON/
russiarunning_Триатлон "МЕДНЫЙ ВСАДНИК" 113 / 226 /эстафета_2026-07-09	https://russiarunning.com/event/Mednyyvsadnik2026/
russiarunning_ОЛИМПИЙСКАЯ СЕРИЯ _ АЛЕКСЕЙ НЕМОВ_2026-07-09	https://russiarunning.com/event/OLIMPIYSKAYaSERIYaALEKSEYNEMOV/
russiarunning_Велокемп Три страны + Путь до моря. Словения_2026-07-11	https://russiarunning.com/event/cycling_slovenia_july_12_18072026/
russiarunning_Полумарафон «Сергиевым путём» – 2026_2026-07-11	https://russiarunning.com/event/BZK_SPosad_26/
russiarunning_17й Уфимский Лесной Марафон 2026 памяти Д.З. Валеева_2026-07-12	https://russiarunning.com/event/17yUfimskiyLesnoyMarafon2026pamyatiDZValeeva/
russiarunning_Женский забег "Медный Всадник" 2026_2026-07-12	https://russiarunning.com/event/ZhenskiyzabegMednyyVsadnik2026/
